{
  "$schema": "https://json-schema.org/draft/2020-12/schema",
  "$id": "https://nocksperimental.dev/schemas/nockapp-lab-fixture.schema.json",
  "title": "Nocksperimental NockApp Lab Fixture",
  "type": "object",
  "required": ["id", "app", "environment", "initialState", "steps", "invariants"],
  "additionalProperties": false,
  "properties": {
    "$schema": {
      "type": "string"
    },
    "id": {
      "type": "string"
    },
    "app": {
      "type": "object",
      "required": ["name", "slug", "version", "kernel"],
      "additionalProperties": false,
      "properties": {
        "name": { "type": "string" },
        "slug": { "type": "string" },
        "version": { "type": "string" },
        "kernel": { "type": "string" }
      }
    },
    "environment": {
      "type": "object",
      "required": ["mode", "grpcEndpoint", "fakenetCommand", "notes"],
      "additionalProperties": false,
      "properties": {
        "mode": {
          "enum": ["mock-fakenet", "local-fakenet", "docker-fakenet"]
        },
        "grpcEndpoint": { "type": "string" },
        "fakenetCommand": { "type": "string" },
        "balanceCheck": {
          "$ref": "#/$defs/balanceCheck"
        },
        "chainCheck": {
          "$ref": "#/$defs/chainCheck"
        },
        "notes": {
          "type": "array",
          "items": { "type": "string" }
        }
      }
    },
    "actors": {
      "type": "array",
      "items": {
        "type": "object",
        "required": ["name", "pkh"],
        "additionalProperties": false,
        "properties": {
          "name": { "type": "string" },
          "pkh": { "type": "string" }
        }
      }
    },
    "invariantPacks": {
      "type": "array",
      "items": { "type": "string" }
    },
    "initialState": {
      "type": "object"
    },
    "steps": {
      "type": "array",
      "minItems": 1,
      "items": {
        "type": "object",
        "required": ["id", "type", "title"],
        "properties": {
          "id": { "type": "string" },
          "type": {
            "enum": ["fakenet", "poke", "peek", "invariant", "bridge"]
          },
          "title": { "type": "string" },
          "actor": { "type": "string" },
          "target": { "type": "string" },
          "input": {},
          "operation": {
            "$ref": "#/$defs/operation"
          },
          "operations": {
            "type": "array",
            "items": {
              "$ref": "#/$defs/operation"
            }
          },
          "statePatch": {
            "type": "object"
          },
          "adapter": {
            "$ref": "#/$defs/stepAdapter"
          },
          "expectation": { "type": "string" },
          "expect": {
            "type": "object",
            "properties": {
              "path": { "type": "string" },
              "equals": {}
            }
          }
        }
      }
    },
    "invariants": {
      "type": "array",
      "items": {
        "type": "object",
        "required": ["id", "title", "severity", "kind"],
        "properties": {
          "id": { "type": "string" },
          "title": { "type": "string" },
          "severity": {
            "enum": ["critical", "high", "medium", "low"]
          },
          "kind": {
            "enum": [
              "numeric-min",
              "state-equals",
              "poke-actors-declared",
              "supply-conservation",
              "timeline-state",
              "authorized-actor",
              "numeric-range",
              "array-length-min",
              "array-length-max",
              "temporal-ordering",
              "custom-function"
            ]
          },
          "path": { "type": "string" },
          "min": { "type": "number" },
          "max": { "type": "number" },
          "equals": {},
          "balancesPath": { "type": "string" },
          "supplyPath": { "type": "string" },
          "actors": {
            "type": "array",
            "items": { "type": "string" }
          },
          "stepType": {
            "enum": ["fakenet", "poke", "peek", "invariant", "bridge"]
          },
          "field": { "type": "string" },
          "before": {},
          "after": {},
          "fn": { "type": "string" },
          "packId": { "type": "string" }
        },
        "allOf": [{ "$ref": "#/$defs/invariantKindRequirements" }]
      }
    },
    "alertPolicies": {
      "type": "array",
      "items": {
        "type": "object",
        "required": ["id", "title", "severity", "condition", "message", "clearMessage"],
        "additionalProperties": false,
        "properties": {
          "id": { "type": "string" },
          "title": { "type": "string" },
          "severity": {
            "enum": ["critical", "warning", "info"]
          },
          "condition": {
            "type": "object",
            "required": ["path", "equals"],
            "additionalProperties": false,
            "properties": {
              "path": { "type": "string" },
              "equals": {}
            }
          },
          "message": { "type": "string" },
          "clearMessage": { "type": "string" }
        }
      }
    }
  },
  "$defs": {
    "invariantKindRequirements": {
      "allOf": [
        {
          "if": { "properties": { "kind": { "const": "numeric-min" } } },
          "then": { "required": ["path", "min"] }
        },
        {
          "if": { "properties": { "kind": { "const": "state-equals" } } },
          "then": { "required": ["path", "equals"] }
        },
        {
          "if": { "properties": { "kind": { "const": "timeline-state" } } },
          "then": { "required": ["path", "equals"] }
        },
        {
          "if": { "properties": { "kind": { "const": "supply-conservation" } } },
          "then": { "required": ["balancesPath", "supplyPath"] }
        },
        {
          "if": { "properties": { "kind": { "const": "authorized-actor" } } },
          "then": {
            "required": ["actors", "stepType"],
            "properties": { "actors": { "minItems": 1 } }
          }
        },
        {
          "if": { "properties": { "kind": { "const": "numeric-range" } } },
          "then": { "required": ["path", "min", "max"] }
        },
        {
          "if": { "properties": { "kind": { "const": "array-length-min" } } },
          "then": { "required": ["path", "min"] }
        },
        {
          "if": { "properties": { "kind": { "const": "array-length-max" } } },
          "then": { "required": ["path", "max"] }
        },
        {
          "if": { "properties": { "kind": { "const": "temporal-ordering" } } },
          "then": { "required": ["path", "field", "before", "after"] }
        },
        {
          "if": { "properties": { "kind": { "const": "custom-function" } } },
          "then": { "required": ["fn", "path"] }
        }
      ]
    },
    "balanceCheck": {
      "type": "object",
      "required": ["address", "command"],
      "additionalProperties": false,
      "properties": {
        "address": { "type": "string" },
        "command": {
          "$ref": "#/$defs/command"
        }
      }
    },
    "chainCheck": {
      "type": "object",
      "required": ["command"],
      "additionalProperties": false,
      "properties": {
        "command": {
          "$ref": "#/$defs/command"
        }
      }
    },
    "stepAdapter": {
      "type": "object",
      "required": ["command"],
      "additionalProperties": false,
      "properties": {
        "command": {
          "$ref": "#/$defs/command"
        },
        "expect": {
          "type": "object",
          "additionalProperties": false,
          "properties": {
            "stdoutIncludes": { "type": "string" }
          }
        }
      }
    },
    "command": {
      "type": "object",
      "required": ["program"],
      "additionalProperties": false,
      "properties": {
        "program": { "type": "string" },
        "args": {
          "type": "array",
          "items": { "type": "string" }
        }
      }
    },
    "operation": {
      "oneOf": [
        {
          "type": "object",
          "required": ["kind", "path", "by"],
          "additionalProperties": false,
          "properties": {
            "kind": { "const": "increment" },
            "path": { "type": "string" },
            "by": { "type": "number" }
          }
        },
        {
          "type": "object",
          "required": ["kind", "path", "value"],
          "additionalProperties": false,
          "properties": {
            "kind": { "const": "set" },
            "path": { "type": "string" },
            "value": {}
          }
        },
        {
          "type": "object",
          "required": ["kind", "fromPath", "toPath", "amount"],
          "additionalProperties": false,
          "properties": {
            "kind": { "const": "transfer" },
            "fromPath": { "type": "string" },
            "toPath": { "type": "string" },
            "amount": { "type": "number" }
          }
        },
        {
          "type": "object",
          "required": ["kind", "path", "value"],
          "additionalProperties": false,
          "properties": {
            "kind": { "const": "append-event" },
            "path": { "type": "string" },
            "value": {}
          }
        }
      ]
    }
  }
}
