{
  "$schema": "../schemas/nockapp-lab-fixture.schema.json",
  "id": "real-fakenet-demo-v0",
  "app": {
    "name": "Real Fakenet Demo",
    "slug": "real-fakenet-demo",
    "version": "0.0.1",
    "kernel": "nockchain-local-fakenet"
  },
  "environment": {
    "mode": "local-fakenet",
    "grpcEndpoint": "127.0.0.1:5555",
    "fakenetCommand": "nockchain --fakenet --bind-public-grpc-addr 127.0.0.1:5555 --bind /ip4/127.0.0.1/udp/3006/quic-v1",
    "notes": [
      "End-to-end demo against a LIVE `nockchain --fakenet` node — see docs/local-fakenet-guide.md.",
      "The health step does a real TCP probe of the public gRPC listener (127.0.0.1:5555).",
      "The peek step runs `nockchain-wallet show-balance` against the live node's public gRPC server.",
      "Requires a running fakenet node and nockchain-wallet on PATH; without a node the probes report unreachable (run without --strict to inspect)."
    ]
  },
  "actors": [
    {
      "name": "operator",
      "pkh": "532AxMqc29thxqonTxkVQ5D1ghfG7a6CN29CDmruQ5HaEVhLqrDqaXQ"
    }
  ],
  "initialState": {
    "fakenet": {
      "expectedEndpoint": "127.0.0.1:5555"
    }
  },
  "steps": [
    {
      "id": "probe-health",
      "type": "fakenet",
      "title": "Probe the live fakenet public gRPC listener",
      "expectation": "the public gRPC endpoint at 127.0.0.1:5555 is reachable over TCP"
    },
    {
      "id": "peek-balance",
      "type": "peek",
      "title": "Read wallet balance from the live node via nockchain-wallet",
      "actor": "operator",
      "target": "nockchain-wallet show-balance",
      "expectation": "nockchain-wallet connects to the node's public gRPC server and returns balance output",
      "adapter": {
        "command": {
          "program": "nockchain-wallet",
          "args": ["show-balance", "--public-grpc-server-addr", "127.0.0.1:5555"]
        },
        "expect": {
          "stdoutIncludes": "Wallet Balance"
        }
      }
    }
  ],
  "invariants": [
    {
      "id": "endpoint-pinned",
      "title": "watched endpoint matches the configured gRPC endpoint",
      "severity": "medium",
      "kind": "state-equals",
      "path": "fakenet.expectedEndpoint",
      "equals": "127.0.0.1:5555"
    }
  ]
}
