{
  "$schema": "../schemas/nockapp-lab-fixture.schema.json",
  "id": "local-fakenet-balance-v0",
  "app": {
    "name": "Local Fakenet Balance",
    "slug": "local-fakenet-balance",
    "version": "0.0.1",
    "kernel": "nockchain-local-fakenet"
  },
  "environment": {
    "mode": "local-fakenet",
    "grpcEndpoint": "127.0.0.1:5555",
    "fakenetCommand": "fakenock --start",
    "balanceCheck": {
      "address": "AU6cMNQ9vMyBwSGkwTghPsTGf6uLREziKnpDrM3y6Jk2zNsvRWdYFVx",
      "command": {
        "program": "fakenock",
        "args": ["--balance"]
      }
    },
    "notes": [
      "Probes the live local Nockchain fakenet public gRPC listener.",
      "Runs fakenock --balance for the configured wallet address.",
      "Run inside WSL or another shell where fakenock is on PATH."
    ]
  },
  "initialState": {
    "fakenet": {
      "expectedEndpoint": "127.0.0.1:5555",
      "watchedAddress": "AU6cMNQ9vMyBwSGkwTghPsTGf6uLREziKnpDrM3y6Jk2zNsvRWdYFVx"
    }
  },
  "steps": [
    {
      "id": "probe-local-fakenet-balance",
      "type": "fakenet",
      "title": "Probe local fakenet balance",
      "expectation": "local fakenet endpoint is reachable and wallet balance can be parsed"
    }
  ],
  "invariants": []
}
